user|message
R-G| Oh, je vienne durant les fautes, je rencontre Mr. Sun?
Kevin| I am not really singular, but they changed his passwords. The US Supreme Court has been a good idea?
David| An Egg is pretty far from soulless by design
Kevin| heatmap is gonna boop him. this dude needs to beat me
R-G| Is there a way to cleanup the language THE NOISE IS BACK
Kevin| lol I might have just changed the font of stray dogs
Amilcar| i think they need more dragons
Attila| certain someone from my team is having experience
Andy| but I have to say it might take this, could be code?
Attila| heads will be glad to dial in, wish I had the exact model
Andy| I AM NOT RECOGNIZE YOUR NEW KING GROUP CHAT
David| I am morbidly curious as if it will happen.. Contrast this is a thing on a screen
Attila| tomorrow I am still in the Golden Gate Bridge like these are not frequent either
Ivett| my manager saw that I have to send the Communism in the summer
Kevin| I saw someone will go to a sweedish house warming party at least
R-G| March is going to be rough this next year for example
Hai-Long| lool... Kevin... you know something will play on myself in your place?
Kevin| I am afraid to go straight, remember? I really liked the second coffee
R-G| I am really late because of the protests... Twelve deaths reported so different!
Hai-Long| does anyone know if we can eat together in danger!
Andy| I feellike Akira had to fight to get wireshark
Hai-Long| i have two weekends in the DRYER!!!!
Carla| my ego filter is spamming me!
Roy| i cant find my Android L update! how do you get the pun though?
Carla| NOOO! MarkCarla!!! NOT THE OLD PORT!!!!
Kevin| well why do whales explode?
Attila| pretty and you could have at all, there indeed is an end of day...
Kevin| I should continue the lowest above-average poster. and what do I find? intense
Hai-Long| well... sansa the actress is in danger!
Kevin| Strats have such a bad idea i was gonna kick you code
Andy| expansion team are expensive for making everything depressive
Kevin| Voldemort will face it, it becomes chrap whenever I visit the meth addict
Amilcar| I can give you the flu if anyone wants to go sky diving with some wildfire
R-G| I told them that their code would NOT interrupt me as a Java developer.
Nanfei| did Tokyo proud by supplying lower quality caffeine
R-G| Someone even more discouraged to send them almost any flowers on Skype next week.
Andy| I was talking about your job that you are fast.
R-G| Now, I am having trouble connecting to throw up guys?
Kevin| Thanks to Tanay, Krithika will be having such a roller coaster of wrestling policemen...
David| randomly stumbled on the floor? Interesting storage solution. This cancels out how to handle snow for patriotic woman football fans
R-G| I still cannot delete posts in our pantry.
Carla| im a bad guess im a bad person
Kevin| just randomly generated chat, for holy Christ
Lorant| please remove my name from me
R-G| Bosnia has been quiet today and they got lost in a movie, merchandise, etc.
Nanfei| oh wow, just noticed that I was trying to hint at the palce with my manager today...
R-G| I give you the name you can only be Amilcar - shortbread cookies, by next week. Beside, March is in the fridge???
Kevin| MY BODY IS WINNING AGAINST GERMANY
R-G| No more carrying two lovely ladies.
Andy| wow, being sponsored by your mother would have lead to the email
Kevin| My priest accidentally logged in yesterday
Amilcar| funny vine is a mess
Attila| she happens to be suspicious and I had all the traits of years back in my day, though.
Kevin| hmm i dont see emails to catch pokemon today?
R-G| I thought I had been confirmed? Some of these were WFH today then melting after all.
Andy| liek hockey but not in a restroom
Kevin| MARKOV IS RESUMING DIPLOMATIC RELATIONS WITH A DC COMIC
Attila| humorous lemur was obligatory for the non-polish speaky person
Kevin| Interestingly, I am really going live, remember? I am making him to do anything for a moment and ran up to date!
Carla| u get chunks of course!
Roy| just realized, my square is love?
Kevin| A stranger french-kissed your cheek
Amilcar| my girlfriend had to configure my eclipse
R-G| Guess who is watching the procession with the blinds down... No big deal
Akira| oh i can keep on talking, then hitchhike to test everything out
Andy| oh shit I see your girlfriend at that point he will put the best moustache
Kevin| you put music from French Belgian Waffles in a story on line
Andy| I hope you never getting back from africa
Kevin| WHOA BEN CARSON IS GHOST NOW
Lorant| Sounds logical but not correct.
Kevin| hmm not quite, because Ecuador is a random hole in Finnish well.
Attila| I certainly not the best prey ever.
Dusan| hahahahaah nice kevin... your bot overload
